{
  "$schema": "https://json-schema.org/draft/2020-12/schema",
  "title": "Goal",
  "description": "One coordinator goal: the repo, outcome and issues that plan sessions turn into work items.",
  "type": "object",
  "additionalProperties": false,
  "required": [
    "schemaVersion",
    "goalId",
    "idPrefix",
    "repo",
    "title",
    "outcome",
    "constraints",
    "issues",
    "maxItems",
    "preferredModel"
  ],
  "properties": {
    "schemaVersion": { "const": "v1" },
    "goalId": { "type": "string", "pattern": "^[a-z][a-z0-9-]{0,31}$" },
    "idPrefix": { "type": "string", "pattern": "^[a-z][a-z0-9]{0,11}$" },
    "repo": { "type": "string", "pattern": "^[A-Za-z0-9_.-]+/[A-Za-z0-9_.-]+$" },
    "title": { "type": "string", "minLength": 1, "maxLength": 200 },
    "outcome": { "type": "string", "minLength": 1 },
    "constraints": {
      "type": "array",
      "maxItems": 20,
      "items": { "type": "string", "minLength": 1, "maxLength": 500 }
    },
    "issues": {
      "type": "array",
      "maxItems": 50,
      "items": {
        "type": "object",
        "additionalProperties": false,
        "required": ["number", "title"],
        "properties": {
          "number": { "type": "integer", "minimum": 1 },
          "title": { "type": "string", "minLength": 1, "maxLength": 200 }
        }
      }
    },
    "maxItems": { "type": "integer", "minimum": 1, "maximum": 50 },
    "preferredModel": { "type": "string", "minLength": 1 }
  }
}
