{
  "schemaVersion": "v1",
  "goalId": "d3",
  "idPrefix": "d3",
  "repo": "example/demo-repo",
  "title": "Record writer for the demo repo",
  "outcome": "src/parser.ts, src/writer.ts and src/report.ts parse, append and summarise records.",
  "constraints": [],
  "issues": [],
  "maxItems": 5,
  "preferredModel": "meta/muse-glimmer-30b"
}
